{
  "facts": {
    "configs": [
      ".claude-plugin/plugin.json",
      ".lsp.json",
      ".mcp.json",
      "evals/evals.json",
      "evals/fixtures/action-items.json",
      "evals/fixtures/council-report.json",
      "evals/fixtures/dashboard-data.json",
      "evals/fixtures/hygiene-report.json",
      "evals/trigger-evals.json",
      "hooks/hooks.json",
      "schemas/action-items.schema.json",
      "schemas/council-report.schema.json",
      "schemas/handoff.schema.json",
      "schemas/human-tasks.schema.json",
      "schemas/lifecycle-map.schema.json",
      "schemas/product-system-profile.schema.json",
      "schemas/repo-hygiene.schema.json",
      "settings.json",
      "skills/build-project-dashboard/templates/dashboard-data.json",
      "skills/create-api-contract/templates/openapi-fragment.yaml",
      "skills/profile-product-system/examples/example-profile.yaml",
      "skills/profile-product-system/templates/product-system-profile.yaml",
      "skills/run-engineering-council/templates/council-input.json",
      "templates/action-items.template.json",
      "templates/handoff.template.json",
      "templates/human-tasks.template.json"
    ],
    "docs": [
      "CHANGELOG.md",
      "README.md",
      "agents/api-contract-reviewer.md",
      "agents/backend-engineer.md",
      "agents/council-chairperson.md",
      "agents/council-contrarian.md",
      "agents/council-executor.md",
      "agents/council-expansionist.md",
      "agents/council-first-principles.md",
      "agents/council-outsider.md",
      "agents/database-engineer.md",
      "agents/devops-release-engineer.md",
      "agents/domain-modeller.md",
      "agents/frontend-engineer.md",
      "agents/product-discovery-lead.md",
      "agents/qa-test-strategist.md",
      "agents/repo-hygiene-maintainer.md",
      "agents/requirements-analyst.md",
      "agents/security-reviewer.md",
      "agents/solution-architect.md",
      "agents/ux-flow-designer.md",
      "evals/fixtures/artifact-invalid.md",
      "evals/fixtures/artifact-valid.md",
      "examples/full-lifecycle-example/01-discovery-brief.md",
      "examples/full-lifecycle-example/02-prd.md",
      "examples/full-lifecycle-example/03-ux-flow.md",
      "examples/full-lifecycle-example/04-system-map.md",
      "examples/full-lifecycle-example/05-architecture-plan.md",
      "examples/full-lifecycle-example/06-data-model.md",
      "examples/full-lifecycle-example/07-implementation-plan.md",
      "examples/full-lifecycle-example/08-test-strategy.md",
      "examples/full-lifecycle-example/09-release-plan.md",
      "references/architecture-mapping-guide.md",
      "references/council-design.md",
      "references/data-modelling-guide.md",
      "references/hook-safety-model.md",
      "references/lifecycle-model.md",
      "references/repo-hygiene-rules.md",
      "references/testing-strategy-guide.md",
      "references/workspace-contract.md",
      "skills/build-project-dashboard/SKILL.md",
      "skills/create-api-contract/SKILL.md",
      "skills/create-api-contract/templates/api-contract.md",
      "skills/create-architecture-plan/SKILL.md",
      "skills/create-architecture-plan/templates/adr.md",
      "skills/create-architecture-plan/templates/architecture-plan.md",
      "skills/create-data-model/SKILL.md",
      "skills/create-data-model/templates/entity-model.md",
      "skills/create-discovery-brief/SKILL.md",
      "skills/create-discovery-brief/templates/discovery-brief.md",
      "skills/create-implementation-plan/SKILL.md",
      "skills/create-implementation-plan/templates/implementation-plan.md",
      "skills/create-implementation-plan/templates/task-breakdown.md",
      "skills/create-prd/SKILL.md",
      "skills/create-prd/templates/prd.md",
      "skills/create-release-plan/SKILL.md",
      "skills/create-release-plan/templates/release-plan.md",
      "skills/create-system-map/SKILL.md",
      "skills/create-system-map/templates/system-map.md",
      "skills/create-test-strategy/SKILL.md",
      "skills/create-test-strategy/templates/test-strategy.md",
      "skills/create-ux-flow/SKILL.md",
      "skills/create-ux-flow/templates/screen-inventory.md",
      "skills/create-ux-flow/templates/ux-flow.md",
      "skills/implement-feature-safely/SKILL.md",
      "skills/implement-feature-safely/templates/implementation-log.md",
      "skills/map-product-lifecycle/SKILL.md",
      "skills/map-product-lifecycle/examples/example-lifecycle-map.md",
      "skills/map-product-lifecycle/templates/lifecycle-map.md",
      "skills/profile-product-system/SKILL.md",
      "skills/review-change/SKILL.md",
      "skills/review-change/templates/change-review.md",
      "skills/run-engineering-council/SKILL.md",
      "skills/run-engineering-council/templates/council-report.md",
      "skills/update-repo-hygiene/SKILL.md",
      "skills/update-repo-hygiene/templates/repo-hygiene-report.md",
      "templates/adr.template.md",
      "templates/prd.template.md",
      "templates/system-map.template.md"
    ],
    "file_count": 132,
    "manifests": [],
    "suffix_counts": {
      ".json": 23,
      ".md": 79,
      ".mmd": 3,
      ".py": 17,
      ".sh": 3,
      ".yaml": 3,
      "<none>": 4
    },
    "tests": []
  },
  "git": {
    "available": false,
    "branch": null,
    "dirty": null
  },
  "repo_root": "C:\\Development\\JOHN_OCONNOR\\johns-os\\engineering-lifecycle",
  "unknowns": [
    "Product goals, target users, and runtime ownership must come from docs or user input.",
    "Secrets and local-only values are intentionally not inspected."
  ]
}
